{
  "protocol_version": 1,
  "instance_id": "11111111-1111-4111-8111-111111111111",
  "key_id": "22222222-2222-4222-8222-222222222222",
  "boot_id": "33333333-3333-4333-8333-333333333333",
  "previous_boot_id": null,
  "first_sequence": 41,
  "events": [
    {
      "sequence": 42,
      "kind": "state_transition",
      "observed_at": "2026-07-24T17:00:00Z",
      "display_state": "working",
      "activity_state": "active",
      "pet_id": "sora-shiba"
    }
  ],
  "sent_at": "2026-07-24T17:00:01Z",
  "client_version": "0.1.0",
  "signature": "AAAAAAAAAAAAAAAAAAAAAAAAAAAAAAAAAAAAAAAAAAAAAAAAAAAAAAAAAAAAAAAAAAAAAAAAAAAAAAAAAAAAAA=="
}
